{
  "event": {
    "id": "evt_004",
    "type": "geopolitical",
    "description": "Export licence suspension on rare-earth concentrate, indefinite",
    "affected_location": "Antofagasta, CL",
    "severity": "high",
    "timestamp": "2026-09-09T07:15:00Z"
  },
  "directly_affected": [
    "sup_007"
  ],
  "cascading_affected": [
    "sup_005",
    "sup_008",
    "sup_002",
    "sup_006",
    "sup_004"
  ],
  "risk_summary": "A high-severity geopolitical event (“Export licence suspension on rare-earth concentrate, indefinite”) has disrupted Altiplano Rare Earth (Neodymium magnet billet), a single-source supplier with no qualified alternate. The disruption propagates to 5 downstream suppliers: Shenzhen Micro Sensors (Manifold pressure sensor array), Great Lakes Stamping (Stamped steel mounting bracket), Delta Assembly Works (Turbocharger subassembly), and 2 more. Principal concerns are 3 single-source dependencies in the affected path and 3 suppliers already flagged on compliance.",
  "draft_report": "To: Compliance Contact\nSubject: Supply disruption — Export licence suspension on rare-earth concentrate, indefinite — action required\n\nA high-severity geopolitical event has been detected affecting Antofagasta, CL.\n\nDirectly affected:\n  - Altiplano Rare Earth (Neodymium magnet billet)\n\nDownstream exposure:\n  - Shenzhen Micro Sensors (Manifold pressure sensor array)\n  - Great Lakes Stamping (Stamped steel mounting bracket)\n  - Delta Assembly Works (Turbocharger subassembly)\n  - Ardennes Wiring Systems (Engine bay wiring harness)\n  - Cascade Final Assembly (Finished powertrain module)\n\nRecommended next steps:\n  1. Confirm on-hand inventory and committed orders for each part listed above.\n  2. Begin qualification review for an alternate source where the affected supplier is single-source.\n  3. Review the compliance status of the flagged suppliers before the next filing window.\n  4. Re-assess once the disruption window closes.\n\nThis draft was prepared automatically for human review and has not been sent."
}
